{
  "loop_name": "ralph-loop-040",
  "loop_file": ".advanced-plans/phases/phase-10/loops.md",
  "task_name": "PreCompact Hook + CLAUDE.md Policy",
  "todos_count": 4,
  "prepared_at": "2026-05-19T08:00:00Z",
  "status": "ready",
  "handoff_injected": {
    "done": "phase-compact.md extended with steps 13-16: handoff.md generation via handoff_digest.py, transparency report via context_meter --report, idempotent CLAUDE.md ## Compaction Instructions maintenance, AskUserQuestion consent gate + ready /compact line + closing summary (never self-compacts); steps 1-12 byte-intact (zero removed lines in git diff)",
    "failed": "",
    "needed": "Loop 040: write PreCompact hook script (never blocks, always exits 0) + register in hooks.json/settings.json + add persistent ## Compaction Instructions block to CLAUDE.md + decision-log entry to CLAUDE.md"
  }
}
